{
  "$schema": "../../../schemas/marketplace-detail.schema.json",
  "schemaVersion": 1,
  "extensionId": "spiritagent.system-message-demo",
  "packageName": "@spiritagent/extension-system-message-demo",
  "status": "listed",
  "featured": true,
  "defaultVersion": "0.1.0",
  "defaultReviewStatus": "verified",
  "readmePath": "extensions/spiritagent.system-message-demo/README.md",
  "versions": [
    {
      "version": "0.1.0",
      "channel": "stable",
      "reviewStatus": "verified",
      "displayName": "System message demo",
      "description": "This is an extension example for having the AI output the system message.",
      "author": "n123999",
      "homepageUrl": "https://github.com/SpiritAgents/extension-system-message-demo#readme",
      "repositoryUrl": "https://github.com/SpiritAgents/extension-system-message-demo",
      "keywords": [
        "spirit-agent",
        "extension",
        "system-prompt"
      ],
      "supportedHosts": [
        "cli",
        "desktop"
      ],
      "requestedCapabilities": [
        "system-prompt"
      ],
      "publishedAt": "2026-08-09T12:52:13.717Z",
      "tarballUrl": "https://registry.npmjs.org/@spiritagent/extension-system-message-demo/-/extension-system-message-demo-0.1.0.tgz",
      "integrity": "sha512-rCFCFXiAhFpPeZiD/0/V1J+Dp1ro9ZKgw9XIIVDoO+x/6QH5UNIIBhbGZkbBZfbIxDMiVhHqmJ39SUSuKmy3sg==",
      "shasum": "776afeb17974134e30b829b9489a67c23dadf137",
      "changelog": {
        "summary": "Initial public release.",
        "body": "- Initial public release.\n- Adds a minimal system-message demo extension."
      }
    }
  ]
}

