{
  "$schema": "../../../schemas/marketplace-detail.schema.json",
  "schemaVersion": 1,
  "extensionId": "n123999.void-theme",
  "packageName": "@n123999/spirit-agent-extension-void-theme",
  "status": "listed",
  "featured": false,
  "defaultVersion": "0.3.1",
  "defaultReviewStatus": "verified",
  "readmePath": "extensions/n123999.void-theme/README.md",
  "versions": [
    {
      "version": "0.3.1",
      "channel": "stable",
      "reviewStatus": "verified",
      "displayName": "Void Desktop CSS",
      "description": "Desktop CSS extension: absolute black, restrained grays, and surgical white accents.",
      "author": "n123999",
      "homepageUrl": "https://github.com/N123999/spirit-agent-extension-void-theme#readme",
      "repositoryUrl": "https://github.com/N123999/spirit-agent-extension-void-theme",
      "keywords": [
        "spirit-agent",
        "spirit-agent-extension",
        "desktop",
        "desktop-ui",
        "theme",
        "css"
      ],
      "supportedHosts": [
        "desktop"
      ],
      "requestedCapabilities": [
        "desktop-ui"
      ],
      "publishedAt": "2026-05-08T01:56:23.9790000Z",
      "tarballUrl": "https://registry.npmjs.org/@n123999/spirit-agent-extension-void-theme/-/spirit-agent-extension-void-theme-0.3.1.tgz",
      "integrity": "sha512-BeO1ttOHaLy7EipwUbRHoeWVh81I8vGlASUZiqxMe8n7bhVh3qY4xNGZI+BIUd/FbixmmfUPa2Cig/jt2vvszA==",
      "shasum": "137ed78c5e08e5a28c406d437cb351e4b4a5b471",
      "changelog": {
        "summary": "unify color scheme",
        "body": "- Unifies the color scheme across the theme.\n- Bumps the package version to 0.3.1."
      }
    },
    {
      "version": "0.3.0",
      "channel": "stable",
      "reviewStatus": "verified",
      "displayName": "Void Desktop CSS",
      "description": "Desktop CSS extension: absolute black, restrained grays, and surgical white accents.",
      "author": "n123999",
      "homepageUrl": "https://github.com/N123999/spirit-agent-extension-void-theme#readme",
      "repositoryUrl": "https://github.com/N123999/spirit-agent-extension-void-theme",
      "keywords": [
        "spirit-agent",
        "spirit-agent-extension",
        "desktop",
        "desktop-ui",
        "theme",
        "css"
      ],
      "supportedHosts": [
        "desktop"
      ],
      "requestedCapabilities": [
        "desktop-ui"
      ],
      "publishedAt": "2026-05-01T23:15:43.8170000Z",
      "tarballUrl": "https://registry.npmjs.org/@n123999/spirit-agent-extension-void-theme/-/spirit-agent-extension-void-theme-0.3.0.tgz",
      "integrity": "sha512-eLHIEkV9AGfuQaOiClrkbUKmHzMRkXoYKELjGkzIbhUqEEeTILKN/7mVGdk89lwHio+qvwpbhNhNTEscFhCD+A==",
      "shasum": "b542e5952a0a65914dc9f9fccf3f8ae117612ba0",
      "changelog": {
        "summary": "Refresh the README image syntax.",
        "body": "- Replaces the HTML image in the README with Markdown syntax.\n- Bumps the package version to 0.3.0."
      }
    },
    {
      "version": "0.2.0",
      "channel": "stable",
      "reviewStatus": "verified",
      "displayName": "Void Desktop CSS",
      "description": "Desktop CSS extension: absolute black, restrained grays, and surgical white accents.",
      "author": "n123999",
      "homepageUrl": "https://github.com/N123999/spirit-agent-extension-void-theme#readme",
      "repositoryUrl": "https://github.com/N123999/spirit-agent-extension-void-theme",
      "keywords": [
        "spirit-agent",
        "spirit-agent-extension",
        "desktop",
        "desktop-ui",
        "theme",
        "css"
      ],
      "supportedHosts": [
        "desktop"
      ],
      "requestedCapabilities": [
        "desktop-ui"
      ],
      "publishedAt": "2026-05-01T22:46:13.9560000Z",
      "tarballUrl": "https://registry.npmjs.org/@n123999/spirit-agent-extension-void-theme/-/spirit-agent-extension-void-theme-0.2.0.tgz",
      "integrity": "sha512-oeou9aVrWlJ+4PkkGTU2BZ9eXUFmVC3mZzmgm6n898t9aak3KYPjtBfHwEcDEaXWRTw4OplIZkKi5rWsOm3Qbg==",
      "shasum": "23ca931e7c0bc8c02abe5a07e8c4d04b5490eaec",
      "changelog": {
        "summary": "Initial public release.",
        "body": "- Initial public release.\n- Adds the Void Desktop CSS theme for the Spirit Agent desktop host."
      }
    }
  ]
}

